emerald_city_of_oz_21_f000017|The nobility enthusiastically applauded, and Dorothy applauded with them.|The nobility enthusiastically applauded, and Dorothy applauded with them.
emerald_city_of_oz_21_f000018|They're fine! she said to the King.|They're fine! she said to the King.
emerald_city_of_oz_21_f000019|Yes, the Whiskered Friskers are really very clever, he replied. I shall hate to part with them when I go away, for they have often amused me when I was very miserable.|Yes, the Whiskered Friskers are really very clever, he replied. I shall hate to part with them when I go away, for they have often amused me when I was very miserable.
emerald_city_of_oz_21_f000020|I wonder if you would ask Glinda No, it wouldn't do at all, declared Dorothy, positively. There wouldn't be room in your hole in the ground for so many rabbits,|I wonder if you would ask Glinda No, it wouldn't do at all, declared Dorothy, positively. There wouldn't be room in your hole in the ground for so many rabbits,
emerald_city_of_oz_21_f000021|'spec'ly when you get the lily chair and your clothes there.|'spec'ly when you get the lily chair and your clothes there.
emerald_city_of_oz_21_f000022|Don't think of such a thing, your Majesty.|Don't think of such a thing, your Majesty.
emerald_city_of_oz_21_f000023|The King sighed. Then he stood up and announced to the company: We will now hold a military drill by my picked Bodyguard of Royal Pikemen.|The King sighed. Then he stood up and announced to the company: We will now hold a military drill by my picked Bodyguard of Royal Pikemen.
emerald_city_of_oz_21_f000024|Now the band played a march and a company of rabbit soldiers came in.|Now the band played a march and a company of rabbit soldiers came in.
emerald_city_of_oz_21_f000025|They wore green and gold uniforms and marched very stiffly but in perfect time. Their spears, or pikes, had slender shafts of polished silver with golden heads,|They wore green and gold uniforms and marched very stiffly but in perfect time. Their spears, or pikes, had slender shafts of polished silver with golden heads,
emerald_city_of_oz_21_f000026|and during the drill they handled these weapons with wonderful dexterity.|and during the drill they handled these weapons with wonderful dexterity.
emerald_city_of_oz_21_f000027|I should think you'd feel pretty safe with such a fine Bodyguard, remarked Dorothy.|I should think you'd feel pretty safe with such a fine Bodyguard, remarked Dorothy.
emerald_city_of_oz_21_f000028|I do, said the King. They protect me from every harm. I suppose Glinda wouldn't No, interrupted the girl; I'm sure she wouldn't. It's the King's own Bodyguard,|I do, said the King. They protect me from every harm. I suppose Glinda wouldn't No, interrupted the girl; I'm sure she wouldn't. It's the King's own Bodyguard,
emerald_city_of_oz_21_f000029|and when you are no longer King you can't have 'em.|and when you are no longer King you can't have 'em.
emerald_city_of_oz_21_f000030|The King did not reply, but he looked rather sorrowful for a time.|The King did not reply, but he looked rather sorrowful for a time.
emerald_city_of_oz_21_f000031|When the soldiers had marched out he said to the company: The Royal Jugglers will now appear.|When the soldiers had marched out he said to the company: The Royal Jugglers will now appear.
emerald_city_of_oz_21_f000032|Dorothy had seen many jugglers in her lifetime, but never any so interesting as these.|Dorothy had seen many jugglers in her lifetime, but never any so interesting as these.
emerald_city_of_oz_21_f000033|There were six of them, dressed in black satin embroidered with queer symbols in silver a costume which contrasted strongly with their snow-white fur.|There were six of them, dressed in black satin embroidered with queer symbols in silver a costume which contrasted strongly with their snow-white fur.
emerald_city_of_oz_21_f000034|First, they pushed in a big red ball and three of the rabbit jugglers stood upon its top and made it roll. Then two of them caught up a third and tossed him into the air,|First, they pushed in a big red ball and three of the rabbit jugglers stood upon its top and made it roll. Then two of them caught up a third and tossed him into the air,
emerald_city_of_oz_21_f000035|all vanishing, until only the two were left.|all vanishing, until only the two were left.
emerald_city_of_oz_21_f000036|Then one of these tossed the other upward and remained alone of all his fellows. This last juggler now touched the red ball, which fell apart,|Then one of these tossed the other upward and remained alone of all his fellows. This last juggler now touched the red ball, which fell apart,
emerald_city_of_oz_21_f000037|being hollow, and the five rabbits who had disappeared in the air scrambled out of the hollow ball.|being hollow, and the five rabbits who had disappeared in the air scrambled out of the hollow ball.
emerald_city_of_oz_21_f000038|Next they all clung together and rolled swiftly upon the floor. When they came to a stop only one fat rabbit juggler was seen, the others seeming to be inside him.|Next they all clung together and rolled swiftly upon the floor. When they came to a stop only one fat rabbit juggler was seen, the others seeming to be inside him.
emerald_city_of_oz_21_f000039|This one leaped lightly into the air and when he came down he exploded and separated into the original six.|This one leaped lightly into the air and when he came down he exploded and separated into the original six.
emerald_city_of_oz_21_f000040|Then four of them rolled themselves into round balls and the other two tossed them around and played ball with them.|Then four of them rolled themselves into round balls and the other two tossed them around and played ball with them.
emerald_city_of_oz_21_f000041|These were but a few of the tricks the rabbit jugglers performed, and they were so skillful that all the nobility and even the King applauded as loudly as did Dorothy.|These were but a few of the tricks the rabbit jugglers performed, and they were so skillful that all the nobility and even the King applauded as loudly as did Dorothy.
emerald_city_of_oz_21_f000042|I suppose there are no rabbit jugglers in all the world to compare with these, remarked the King. And since I may not have the Whiskers Friskers or my Bodyguard,|I suppose there are no rabbit jugglers in all the world to compare with these, remarked the King. And since I may not have the Whiskers Friskers or my Bodyguard,
emerald_city_of_oz_21_f000043|you might ask Glinda to let me take away just two or three of these jugglers. Will you?|you might ask Glinda to let me take away just two or three of these jugglers. Will you?
emerald_city_of_oz_21_f000044|I'll ask her, replied Dorothy, doubtfully.|I'll ask her, replied Dorothy, doubtfully.
emerald_city_of_oz_21_f000045|Thank you, said the King; thank you very much. And now you shall listen to the Winsome Waggish Warblers, who have often cheered me in my moments of anguish.|Thank you, said the King; thank you very much. And now you shall listen to the Winsome Waggish Warblers, who have often cheered me in my moments of anguish.
emerald_city_of_oz_21_f000046|The Winsome Waggish Warblers proved to be a quartette of rabbit singers, two gentlemen and two lady rabbits. The gentlemen Warblers wore full-dress swallow-tailed suits of white satin,|The Winsome Waggish Warblers proved to be a quartette of rabbit singers, two gentlemen and two lady rabbits. The gentlemen Warblers wore full-dress swallow-tailed suits of white satin,
emerald_city_of_oz_21_f000047|with pearls for buttons, while the lady Warblers were gowned in white satin dresses with long trails.|with pearls for buttons, while the lady Warblers were gowned in white satin dresses with long trails.
emerald_city_of_oz_21_f000048|The first song they sang began in this way: When a rabbit gets a habit Of living in a city And wearing clothes and furbelows And jewels rare and pretty,|The first song they sang began in this way: When a rabbit gets a habit Of living in a city And wearing clothes and furbelows And jewels rare and pretty,
emerald_city_of_oz_21_f000049|He scorns the Bun who has to run And burrow in the ground And pities those whose watchful foes Are man and gun and hound.|He scorns the Bun who has to run And burrow in the ground And pities those whose watchful foes Are man and gun and hound.
emerald_city_of_oz_21_f000050|Dorothy looked at the King when she heard this song and noticed that he seemed disturbed and ill at ease.|Dorothy looked at the King when she heard this song and noticed that he seemed disturbed and ill at ease.
emerald_city_of_oz_21_f000051|I don't like that song, he said to the Warblers. Give us something jolly and rollicking.|I don't like that song, he said to the Warblers. Give us something jolly and rollicking.
emerald_city_of_oz_21_f000052|So they sang to a joyous, tinkling melody as follows: Bunnies gay Delight to play In their fairy town secure;|So they sang to a joyous, tinkling melody as follows: Bunnies gay Delight to play In their fairy town secure;
emerald_city_of_oz_21_f000053|Ev'ry frisker Flirts his whisker At a pink-eyed girl demure.|Ev'ry frisker Flirts his whisker At a pink-eyed girl demure.
emerald_city_of_oz_21_f000054|Ev'ry maid In silk arrayed At her partner shyly glances, Paws are grasped, Waists are clasped As they whirl in giddy dances.|Ev'ry maid In silk arrayed At her partner shyly glances, Paws are grasped, Waists are clasped As they whirl in giddy dances.
emerald_city_of_oz_21_f000055|Then together Through the heather 'Neath the moonlight soft they stroll; Each is very Blithe and merry, Gamboling with laughter droll.|Then together Through the heather 'Neath the moonlight soft they stroll; Each is very Blithe and merry, Gamboling with laughter droll.
emerald_city_of_oz_21_f000056|Life is fun To ev'ry one Guarded by our magic charm For to dangers We are strangers, Safe from any thought of harm.|Life is fun To ev'ry one Guarded by our magic charm For to dangers We are strangers, Safe from any thought of harm.
emerald_city_of_oz_21_f000057|You see, said Dorothy to the King, when the song ended, the rabbits all seem to like Bunnybury except you.|You see, said Dorothy to the King, when the song ended, the rabbits all seem to like Bunnybury except you.
emerald_city_of_oz_21_f000058|And I guess you're the only one that ever has cried or was unhappy and wanted to get back to your muddy hole in the ground.|And I guess you're the only one that ever has cried or was unhappy and wanted to get back to your muddy hole in the ground.
emerald_city_of_oz_21_f000059|His Majesty seemed thoughtful, and while the servants passed around glasses of nectar and plates of frosted cakes their King was silent and a bit nervous.|His Majesty seemed thoughtful, and while the servants passed around glasses of nectar and plates of frosted cakes their King was silent and a bit nervous.
emerald_city_of_oz_21_f000060|When the refreshments had been enjoyed by all and the servants had retired Dorothy said: I must go now, for it's getting late and I'm lost.|When the refreshments had been enjoyed by all and the servants had retired Dorothy said: I must go now, for it's getting late and I'm lost.
emerald_city_of_oz_21_f000061|I've got to find the Wizard and Aunt Em and Uncle Henry and all the rest sometime before night comes, if I poss'bly can.|I've got to find the Wizard and Aunt Em and Uncle Henry and all the rest sometime before night comes, if I poss'bly can.
emerald_city_of_oz_21_f000062|Won't you stay with us? asked the King. You will be very welcome.|Won't you stay with us? asked the King. You will be very welcome.
emerald_city_of_oz_21_f000063|No, thank you, she replied. I must get back to my friends. And I want to see Glinda just as soon as I can, you know.|No, thank you, she replied. I must get back to my friends. And I want to see Glinda just as soon as I can, you know.
emerald_city_of_oz_21_f000064|So the King dismissed his court and said he would himself walk with Dorothy to the gate.|So the King dismissed his court and said he would himself walk with Dorothy to the gate.
emerald_city_of_oz_21_f000065|He did not weep nor groan any more, but his long face was quite solemn and his big ears hung dejectedly on each side of it.|He did not weep nor groan any more, but his long face was quite solemn and his big ears hung dejectedly on each side of it.
emerald_city_of_oz_21_f000066|He still wore his crown and his ermine and walked with a handsome gold-headed cane.|He still wore his crown and his ermine and walked with a handsome gold-headed cane.
emerald_city_of_oz_21_f000067|When they arrived at the room in the wall the little girl found Toto and Billina waiting for her very patiently.|When they arrived at the room in the wall the little girl found Toto and Billina waiting for her very patiently.
emerald_city_of_oz_21_f000068|They had been liberally fed by some of the attendants and were in no hurry to leave such comfortable quarters.|They had been liberally fed by some of the attendants and were in no hurry to leave such comfortable quarters.
emerald_city_of_oz_21_f000069|The Keeper of the Wicket was by this time back in his old place, but he kept a safe distance from Toto. Dorothy bade good bye to the King as they stood just inside the wall.|The Keeper of the Wicket was by this time back in his old place, but he kept a safe distance from Toto. Dorothy bade good bye to the King as they stood just inside the wall.
emerald_city_of_oz_21_f000070|You've been good to me, she said, and I thank you ever so much. As soon as poss'ble I'll see Glinda and ask her to put another King in your place and send you back into the wild forest.|You've been good to me, she said, and I thank you ever so much. As soon as poss'ble I'll see Glinda and ask her to put another King in your place and send you back into the wild forest.
emerald_city_of_oz_21_f000071|And I'll ask her to let you keep some of your clothes and the lily chair and one or two jugglers to amuse you. I'm sure she will do it, 'cause she's so kind she doesn't like any one to be unhappy.|And I'll ask her to let you keep some of your clothes and the lily chair and one or two jugglers to amuse you. I'm sure she will do it, 'cause she's so kind she doesn't like any one to be unhappy.
emerald_city_of_oz_21_f000072|Ahem! said the King, looking rather downcast. I don't like to trouble you with my misery; so you needn't see Glinda.|Ahem! said the King, looking rather downcast. I don't like to trouble you with my misery; so you needn't see Glinda.
emerald_city_of_oz_21_f000073|Oh, yes I will, she replied. It won't be any trouble at all.|Oh, yes I will, she replied. It won't be any trouble at all.
emerald_city_of_oz_21_f000074|But, my dear, continued the King, in an embarrassed way, I've been thinking the subject over carefully, and I find there are a lot of pleasant things here in Bunnybury that I would miss if I went away.|But, my dear, continued the King, in an embarrassed way, I've been thinking the subject over carefully, and I find there are a lot of pleasant things here in Bunnybury that I would miss if I went away.
emerald_city_of_oz_21_f000075|So perhaps I'd better stay.|So perhaps I'd better stay.
emerald_city_of_oz_21_f000076|Dorothy laughed. Then she looked grave.|Dorothy laughed. Then she looked grave.
emerald_city_of_oz_21_f000077|It won't do for you to be a King and a cry-baby at the same time, she said. You've been making all the other rabbits unhappy and discontented with your howls about being so miserable.|It won't do for you to be a King and a cry-baby at the same time, she said. You've been making all the other rabbits unhappy and discontented with your howls about being so miserable.
emerald_city_of_oz_21_f000078|So I guess it's better to have another King.|So I guess it's better to have another King.
emerald_city_of_oz_21_f000079|Oh, no indeed! exclaimed the King, earnestly. If you won't say anything to Glinda I'll promise to be merry and gay all the time, and never cry or wail again.|Oh, no indeed! exclaimed the King, earnestly. If you won't say anything to Glinda I'll promise to be merry and gay all the time, and never cry or wail again.
emerald_city_of_oz_21_f000080|Honor bright? she asked.|Honor bright? she asked.
emerald_city_of_oz_21_f000081|On the royal word of a King I promise it! he answered.|On the royal word of a King I promise it! he answered.
emerald_city_of_oz_21_f000082|All right, said Dorothy. You'd be a reg'lar lunatic to want to leave Bunnybury for a wild life in the forest, and I'm sure any rabbit outside the city would be glad to take your place.|All right, said Dorothy. You'd be a reg'lar lunatic to want to leave Bunnybury for a wild life in the forest, and I'm sure any rabbit outside the city would be glad to take your place.
emerald_city_of_oz_21_f000083|Forget it, my dear; forget all my foolishness, pleaded the King, earnestly. Hereafter I'll try to enjoy myself and do my duty by my subjects.|Forget it, my dear; forget all my foolishness, pleaded the King, earnestly. Hereafter I'll try to enjoy myself and do my duty by my subjects.
emerald_city_of_oz_21_f000084|So then she left him and entered through the little door into the room in the wall, where she grew gradually bigger and bigger until she had resumed her natural size.|So then she left him and entered through the little door into the room in the wall, where she grew gradually bigger and bigger until she had resumed her natural size.
emerald_city_of_oz_21_f000085|The Keeper of the Wicket let them out into the forest and told Dorothy that she had been of great service to Bunnybury|The Keeper of the Wicket let them out into the forest and told Dorothy that she had been of great service to Bunnybury
emerald_city_of_oz_21_f000086|because she had brought their dismal King to a realization of the pleasure of ruling so beautiful a city.|because she had brought their dismal King to a realization of the pleasure of ruling so beautiful a city.
emerald_city_of_oz_21_f000087|I shall start a petition to have your statue erected beside Glinda's in the public square, said the Keeper. I hope you will come again, some day, and see it.|I shall start a petition to have your statue erected beside Glinda's in the public square, said the Keeper. I hope you will come again, some day, and see it.
emerald_city_of_oz_21_f000088|Perhaps I shall, she replied.|Perhaps I shall, she replied.
emerald_city_of_oz_21_f000089|Then, followed by Toto and Billina, she walked away from the high marble wall and started back along the narrow path toward the sign-post.|Then, followed by Toto and Billina, she walked away from the high marble wall and started back along the narrow path toward the sign-post.
emerald_city_of_oz_21_f000090|End of chapter 21.|End of chapter twenty-one.
emerald_city_of_oz_22_f000001|This is there librivox re cording. All librivox recordings are in the public domain. For more information or to volunteer please visit librivox dot org.|This is there librivox re cording. All librivox recordings are in the public domain. For more information or to volunteer please visit librivox dot org.
emerald_city_of_oz_22_f000002|The The Emerald City of Oz by L Frank Baum. Chapter 22. How the Wizard Found Dorothy.|The The Emerald City of Oz by L Frank Baum. Chapter twenty-two. How the Wizard Found Dorothy.
emerald_city_of_oz_22_f000003|When they came to the signpost, there, to their joy, were the tents of the Wizard pitched beside the path and the kettle bubbling merrily over the fire.|When they came to the signpost, there, to their joy, were the tents of the Wizard pitched beside the path and the kettle bubbling merrily over the fire.
emerald_city_of_oz_22_f000004|The Shaggy Man and Omby Amby were gathering firewood while Uncle Henry and Aunt Em sat in their camp chairs talking with the Wizard.|The Shaggy Man and Omby Amby were gathering firewood while Uncle Henry and Aunt Em sat in their camp chairs talking with the Wizard.
emerald_city_of_oz_22_f000005|They all ran forward to greet Dorothy, as she approached, and Aunt Em exclaimed: Goodness gracious, child! Where have you been?|They all ran forward to greet Dorothy, as she approached, and Aunt Em exclaimed: Goodness gracious, child! Where have you been?
emerald_city_of_oz_22_f000006|You've played hookey the whole day, added the Shaggy Man, reproachfully.|You've played hookey the whole day, added the Shaggy Man, reproachfully.
emerald_city_of_oz_22_f000007|Well, you see, I've been lost, explained the little girl, and I've tried awful hard to find the way back to you, but just couldn't do it.|Well, you see, I've been lost, explained the little girl, and I've tried awful hard to find the way back to you, but just couldn't do it.
emerald_city_of_oz_22_f000008|Did you wander in the forest all day? asked Uncle Henry.|Did you wander in the forest all day? asked Uncle Henry.
emerald_city_of_oz_22_f000009|You must be a'most starved! said Aunt Em.|You must be a'most starved! said Aunt Em.
emerald_city_of_oz_22_f000010|No, said Dorothy, I'm not hungry. I had a wheelbarrow and a piano for breakfast, and lunched with a King.|No, said Dorothy, I'm not hungry. I had a wheelbarrow and a piano for breakfast, and lunched with a King.
emerald_city_of_oz_22_f000011|Ah! exclaimed the Wizard, nodding with a bright smile. So you've been having adventures again.|Ah! exclaimed the Wizard, nodding with a bright smile. So you've been having adventures again.
emerald_city_of_oz_22_f000012|She's stark crazy! cried Aunt Em. Whoever heard of eating a wheelbarrow?|She's stark crazy! cried Aunt Em. Whoever heard of eating a wheelbarrow?
emerald_city_of_oz_22_f000013|It wasn't very big, said Dorothy; and it had a zuzu wheel.|It wasn't very big, said Dorothy; and it had a zuzu wheel.
emerald_city_of_oz_22_f000014|And I ate the crumbs, said Billina, soberly.|And I ate the crumbs, said Billina, soberly.
emerald_city_of_oz_22_f000015|Sit down and tell us about it, begged the Wizard. We've hunted for you all day, and at last I noticed your footsteps in this path and the tracks of Billina.|Sit down and tell us about it, begged the Wizard. We've hunted for you all day, and at last I noticed your footsteps in this path and the tracks of Billina.
emerald_city_of_oz_22_f000016|We found the path by accident, and seeing it only led to two places I decided you were at either one or the other of those places. So we made camp and waited for you to return.|We found the path by accident, and seeing it only led to two places I decided you were at either one or the other of those places. So we made camp and waited for you to return.
emerald_city_of_oz_22_f000017|And now, Dorothy, tell us where you have been to Bunbury or to Bunnybury?|And now, Dorothy, tell us where you have been to Bunbury or to Bunnybury?
emerald_city_of_oz_22_f000018|Why, I've been to both, she replied; but first I went to Utensia, which isn't on any path at all.|Why, I've been to both, she replied; but first I went to Utensia, which isn't on any path at all.
emerald_city_of_oz_22_f000019|She then sat down and related the day's adventures, and you may be sure Aunt Em and Uncle Henry were much astonished at the story.|She then sat down and related the day's adventures, and you may be sure Aunt Em and Uncle Henry were much astonished at the story.
emerald_city_of_oz_22_f000020|But after seeing the Cuttenclips and the Fuddles, remarked her uncle, we ought not to wonder at anything in this strange country.|But after seeing the Cuttenclips and the Fuddles, remarked her uncle, we ought not to wonder at anything in this strange country.
emerald_city_of_oz_22_f000021|Seems like the only common and ordinary folks here are ourselves, rejoined Aunt Em, diffidently.|Seems like the only common and ordinary folks here are ourselves, rejoined Aunt Em, diffidently.
emerald_city_of_oz_22_f000022|Now that we're together again, and one reunited party, observed the Shaggy Man, what are we to do next?|Now that we're together again, and one reunited party, observed the Shaggy Man, what are we to do next?
emerald_city_of_oz_22_f000023|Have some supper and a night's rest, answered the Wizard promptly, and then proceed upon our journey.|Have some supper and a night's rest, answered the Wizard promptly, and then proceed upon our journey.
emerald_city_of_oz_22_f000024|Where to? asked the Captain General.|Where to? asked the Captain General.
emerald_city_of_oz_22_f000025|We haven't visited the Rigmaroles or the Flutterbudgets yet, said Dorothy. I'd like to see them wouldn't you?|We haven't visited the Rigmaroles or the Flutterbudgets yet, said Dorothy. I'd like to see them wouldn't you?
emerald_city_of_oz_22_f000026|They don't sound very interesting, objected Aunt Em. But perhaps they are.|They don't sound very interesting, objected Aunt Em. But perhaps they are.
emerald_city_of_oz_22_f000027|And then, continued the little Wizard, we will call upon the Tin Woodman and Jack Pumpkinhead and our old friend the Scarecrow, on our way home.|And then, continued the little Wizard, we will call upon the Tin Woodman and Jack Pumpkinhead and our old friend the Scarecrow, on our way home.
emerald_city_of_oz_22_f000028|That will be nice! cried Dorothy, eagerly.|That will be nice! cried Dorothy, eagerly.
emerald_city_of_oz_22_f000029|Can't say THEY sound very interesting, either, remarked Aunt Em.|Can't say THEY sound very interesting, either, remarked Aunt Em.
emerald_city_of_oz_22_f000030|Why, they're the best friends I have! asserted the little girl, and you're sure to like them, Aunt Em, 'cause EVER'body likes them.|Why, they're the best friends I have! asserted the little girl, and you're sure to like them, Aunt Em, 'cause EVER'body likes them.
