emerald_city_of_oz_13_f000005|Good! exclaimed the King. What reward did you promise them?|Good! exclaimed the King. What reward did you promise them?
emerald_city_of_oz_13_f000006|Your Majesty is to use the Magic Belt to give each Whimsie a large, fine head, in place of the small one he is now obliged to wear.|Your Majesty is to use the Magic Belt to give each Whimsie a large, fine head, in place of the small one he is now obliged to wear.
emerald_city_of_oz_13_f000007|I agree to that, said the King. This is good news, Guph, and it makes me feel more certain of the conquest of Oz.|I agree to that, said the King. This is good news, Guph, and it makes me feel more certain of the conquest of Oz.
emerald_city_of_oz_13_f000008|But I have other news for you, announced the General.|But I have other news for you, announced the General.
emerald_city_of_oz_13_f000009|Good or bad?|Good or bad?
emerald_city_of_oz_13_f000010|Good, your Majesty.|Good, your Majesty.
emerald_city_of_oz_13_f000011|Then I will hear it, said the King, with interest.|Then I will hear it, said the King, with interest.
emerald_city_of_oz_13_f000012|The Growleywogs will join us.|The Growleywogs will join us.
emerald_city_of_oz_13_f000013|No! cried the astonished King.|No! cried the astonished King.
emerald_city_of_oz_13_f000014|Yes, indeed, said the General. I have their promise.|Yes, indeed, said the General. I have their promise.
emerald_city_of_oz_13_f000015|But what reward do they demand? inquired the King, suspiciously, for he knew how greedy the Growleywogs were.|But what reward do they demand? inquired the King, suspiciously, for he knew how greedy the Growleywogs were.
emerald_city_of_oz_13_f000016|They are to take a few of the Oz people for their slaves, replied Guph. He did not think it necessary to tell Roquat that the Growleywogs demanded twenty thousand slaves.|They are to take a few of the Oz people for their slaves, replied Guph. He did not think it necessary to tell Roquat that the Growleywogs demanded twenty thousand slaves.
emerald_city_of_oz_13_f000017|It would be time enough for that when Oz was conquered.|It would be time enough for that when Oz was conquered.
emerald_city_of_oz_13_f000018|A very reasonable request, I'm sure, remarked the King. I must congratulate you, Guph, upon the wonderful success of your journey.|A very reasonable request, I'm sure, remarked the King. I must congratulate you, Guph, upon the wonderful success of your journey.
emerald_city_of_oz_13_f000019|But that is not all, said the General, proudly.|But that is not all, said the General, proudly.
emerald_city_of_oz_13_f000020|The King seemed astonished. Speak out, sir! he commanded.|The King seemed astonished. Speak out, sir! he commanded.
emerald_city_of_oz_13_f000021|I have seen the First and Foremost Phanfasm of the Mountain of Phantastico, and he will bring his people to assist us.|I have seen the First and Foremost Phanfasm of the Mountain of Phantastico, and he will bring his people to assist us.
emerald_city_of_oz_13_f000022|What! cried the King. The Phanfasms! You don't mean it, Guph!|What! cried the King. The Phanfasms! You don't mean it, Guph!
emerald_city_of_oz_13_f000023|It is true, declared the General, proudly.|It is true, declared the General, proudly.
emerald_city_of_oz_13_f000024|The King became thoughtful, and his brows wrinkled.|The King became thoughtful, and his brows wrinkled.
emerald_city_of_oz_13_f000025|I'm afraid, Guph, he said rather anxiously, that the First and Foremost may prove as dangerous to us as to the Oz people.|I'm afraid, Guph, he said rather anxiously, that the First and Foremost may prove as dangerous to us as to the Oz people.
emerald_city_of_oz_13_f000026|If he and his terrible band come down from the mountain they may take the notion to conquer the Nomes!|If he and his terrible band come down from the mountain they may take the notion to conquer the Nomes!
emerald_city_of_oz_13_f000027|Pah! That is a foolish idea, retorted Guph, irritably, but he knew in his heart that the King was right. The First and Foremost is a particular friend of mine, and will do us no harm.|Pah! That is a foolish idea, retorted Guph, irritably, but he knew in his heart that the King was right. The First and Foremost is a particular friend of mine, and will do us no harm.
emerald_city_of_oz_13_f000028|Why, when I was there, he even invited me into his house.|Why, when I was there, he even invited me into his house.
emerald_city_of_oz_13_f000029|The General neglected to tell the King how he had been jerked into the hut of the First and Foremost by means of the brass hoop. So Roquat the Red looked at his General admiringly and said:|The General neglected to tell the King how he had been jerked into the hut of the First and Foremost by means of the brass hoop. So Roquat the Red looked at his General admiringly and said:
emerald_city_of_oz_13_f000030|You are a wonderful Nome, Guph.|You are a wonderful Nome, Guph.
emerald_city_of_oz_13_f000031|I'm sorry I did not make you my General before. But what reward did the First and Foremost demand?|I'm sorry I did not make you my General before. But what reward did the First and Foremost demand?
emerald_city_of_oz_13_f000032|Nothing at all, answered Guph. Even the Magic Belt itself could not add to his powers of sorcery. All the Phanfasms wish is to destroy the Oz people, who are good and happy.|Nothing at all, answered Guph. Even the Magic Belt itself could not add to his powers of sorcery. All the Phanfasms wish is to destroy the Oz people, who are good and happy.
emerald_city_of_oz_13_f000033|This pleasure will amply repay them for assisting us.|This pleasure will amply repay them for assisting us.
emerald_city_of_oz_13_f000034|When will they come? asked Roquat, half fearfully.|When will they come? asked Roquat, half fearfully.
emerald_city_of_oz_13_f000035|When the tunnel is completed, said the General.|When the tunnel is completed, said the General.
emerald_city_of_oz_13_f000036|We are nearly halfway under the desert now, announced the King; and that is fast work, because the tunnel has to be drilled through solid rock.|We are nearly halfway under the desert now, announced the King; and that is fast work, because the tunnel has to be drilled through solid rock.
emerald_city_of_oz_13_f000037|But after we have passed the desert it will not take us long to extend the tunnel to the walls of the Emerald City.|But after we have passed the desert it will not take us long to extend the tunnel to the walls of the Emerald City.
emerald_city_of_oz_13_f000038|Well, whenever you are ready, we shall be joined by the Whimsies, the Growleywogs and the Phanfasms, said Guph; so the conquest of Oz is assured without a doubt.|Well, whenever you are ready, we shall be joined by the Whimsies, the Growleywogs and the Phanfasms, said Guph; so the conquest of Oz is assured without a doubt.
emerald_city_of_oz_13_f000039|Again, the King seemed thoughtful.|Again, the King seemed thoughtful.
emerald_city_of_oz_13_f000040|I'm almost sorry we did not undertake the conquest alone, said he.|I'm almost sorry we did not undertake the conquest alone, said he.
emerald_city_of_oz_13_f000041|All of these allies are dangerous people, and they may demand more than you have promised them. It might have been better to have conquered Oz without any outside assistance.|All of these allies are dangerous people, and they may demand more than you have promised them. It might have been better to have conquered Oz without any outside assistance.
emerald_city_of_oz_13_f000042|We could not do it, said the General, positively.|We could not do it, said the General, positively.
emerald_city_of_oz_13_f000043|Why not, Guph?|Why not, Guph?
emerald_city_of_oz_13_f000044|You know very well. You have had one experience with the Oz people, and they defeated you.|You know very well. You have had one experience with the Oz people, and they defeated you.
emerald_city_of_oz_13_f000045|That was because they rolled eggs at us, replied the King, with a shudder. My Nomes cannot stand eggs, any more than I can myself.|That was because they rolled eggs at us, replied the King, with a shudder. My Nomes cannot stand eggs, any more than I can myself.
emerald_city_of_oz_13_f000046|They are poison to all who live underground.|They are poison to all who live underground.
emerald_city_of_oz_13_f000047|That is true enough, agreed Guph.|That is true enough, agreed Guph.
emerald_city_of_oz_13_f000048|But we might have taken the Oz people by surprise, and conquered them before they had a chance to get any eggs. Our former defeat was due to the fact that the girl Dorothy had a Yellow Hen with her.|But we might have taken the Oz people by surprise, and conquered them before they had a chance to get any eggs. Our former defeat was due to the fact that the girl Dorothy had a Yellow Hen with her.
emerald_city_of_oz_13_f000049|I do not know what ever became of that hen, but I believe there are no hens at all in the Land of Oz, and so there could be no eggs there.|I do not know what ever became of that hen, but I believe there are no hens at all in the Land of Oz, and so there could be no eggs there.
emerald_city_of_oz_13_f000050|On the contrary, said Guph, there are now hundreds of chickens in Oz, and they lay heaps of those dangerous eggs. I met a goshawk on my way home,|On the contrary, said Guph, there are now hundreds of chickens in Oz, and they lay heaps of those dangerous eggs. I met a goshawk on my way home,
emerald_city_of_oz_13_f000051|and the bird informed me that he had lately been to Oz to capture and devour some of the young chickens.|and the bird informed me that he had lately been to Oz to capture and devour some of the young chickens.
emerald_city_of_oz_13_f000052|But they are protected by magic, so the hawk did not get a single one of them.|But they are protected by magic, so the hawk did not get a single one of them.
emerald_city_of_oz_13_f000053|That is a very bad report, said the King, nervously. Very bad, indeed. My Nomes are willing to fight, but they simply can't face hen's eggs and I don't blame them.|That is a very bad report, said the King, nervously. Very bad, indeed. My Nomes are willing to fight, but they simply can't face hen's eggs and I don't blame them.
emerald_city_of_oz_13_f000054|They won't need to face them, replied Guph. I'm afraid of eggs myself, and don't propose to take any chances of being poisoned by them. My plan is to send the Whimsies through the tunnel first,|They won't need to face them, replied Guph. I'm afraid of eggs myself, and don't propose to take any chances of being poisoned by them. My plan is to send the Whimsies through the tunnel first,
emerald_city_of_oz_13_f000055|and then the Growleywogs and the Phanfasms.|and then the Growleywogs and the Phanfasms.
emerald_city_of_oz_13_f000056|By the time we Nomes get there the eggs will all be used up, and we may then pursue and capture the inhabitants at our leisure.|By the time we Nomes get there the eggs will all be used up, and we may then pursue and capture the inhabitants at our leisure.
emerald_city_of_oz_13_f000057|Perhaps you are right, returned the King, with a dismal sigh. But I want it distinctly understood that I claim Ozma and Dorothy as my own prisoners.|Perhaps you are right, returned the King, with a dismal sigh. But I want it distinctly understood that I claim Ozma and Dorothy as my own prisoners.
emerald_city_of_oz_13_f000058|They are rather nice girls, and I do not intend to let any of those dreadful creatures hurt them, or make them their slaves.|They are rather nice girls, and I do not intend to let any of those dreadful creatures hurt them, or make them their slaves.
emerald_city_of_oz_13_f000059|When I have captured them I will bring them here and transform them into china ornaments to stand on my mantle.|When I have captured them I will bring them here and transform them into china ornaments to stand on my mantle.
emerald_city_of_oz_13_f000060|They will look very pretty Dorothy on one end of the mantle and Ozma on the other and I shall take great care to see they are not broken when the maids dust them.|They will look very pretty Dorothy on one end of the mantle and Ozma on the other and I shall take great care to see they are not broken when the maids dust them.
emerald_city_of_oz_13_f000061|Very well, your Majesty. Do what you will with the girls for all I care. Now that our plans are arranged, and we have the three most powerful bands of evil spirits in the world to assist us,|Very well, your Majesty. Do what you will with the girls for all I care. Now that our plans are arranged, and we have the three most powerful bands of evil spirits in the world to assist us,
emerald_city_of_oz_13_f000062|let us make haste to get the tunnel finished as soon as possible.|let us make haste to get the tunnel finished as soon as possible.
emerald_city_of_oz_13_f000063|It will be ready in three days, promised the King, and hurried away to inspect the work and see that the Nomes kept busy.|It will be ready in three days, promised the King, and hurried away to inspect the work and see that the Nomes kept busy.
emerald_city_of_oz_13_f000064|End of chapter 13.|End of chapter thirteen.
emerald_city_of_oz_14_f000001|This is there librivox re cording. All librivox recordings are in the public domain. For more information or to volunteer please visit librivox dot org.|This is there librivox re cording. All librivox recordings are in the public domain. For more information or to volunteer please visit librivox dot org.
emerald_city_of_oz_14_f000002|The The Emerald City of Oz by L Frank Baum. Chapter 14. How the Wizard Practiced Sorcery.|The The Emerald City of Oz by L Frank Baum. Chapter fourteen. How the Wizard Practiced Sorcery.
emerald_city_of_oz_14_f000003|Where next? asked the Wizard when they had left the town of Fuddlecumjig and the Sawhorse had started back along the road.|Where next? asked the Wizard when they had left the town of Fuddlecumjig and the Sawhorse had started back along the road.
emerald_city_of_oz_14_f000004|Why, Ozma laid out this trip, replied Dorothy, and she 'vised us to see the Rigmaroles next, and then visit the Tin Woodman.|Why, Ozma laid out this trip, replied Dorothy, and she 'vised us to see the Rigmaroles next, and then visit the Tin Woodman.
emerald_city_of_oz_14_f000005|That sounds good, said the Wizard. But what road do we take to get to the Rigmaroles?|That sounds good, said the Wizard. But what road do we take to get to the Rigmaroles?
emerald_city_of_oz_14_f000006|I don't know, 'zactly, returned the little girl; but it must be somewhere just southwest from here.|I don't know, 'zactly, returned the little girl; but it must be somewhere just southwest from here.
emerald_city_of_oz_14_f000007|Then why need we go way back to the crossroads? asked the Shaggy Man.|Then why need we go way back to the crossroads? asked the Shaggy Man.
emerald_city_of_oz_14_f000008|We might save a lot of time by branching off here.|We might save a lot of time by branching off here.
emerald_city_of_oz_14_f000009|There isn't any path, asserted Uncle Henry.|There isn't any path, asserted Uncle Henry.
emerald_city_of_oz_14_f000010|Then we'd better go back to the signposts, and make sure of our way, decided Dorothy.|Then we'd better go back to the signposts, and make sure of our way, decided Dorothy.
emerald_city_of_oz_14_f000011|But after they had gone a short distance farther the Sawhorse, who had overheard their conversation, stopped and said: Here is a path.|But after they had gone a short distance farther the Sawhorse, who had overheard their conversation, stopped and said: Here is a path.
emerald_city_of_oz_14_f000012|Sure enough, a dim path seemed to branch off from the road they were on, and it led across pretty green meadows and past leafy groves, straight toward the southwest.|Sure enough, a dim path seemed to branch off from the road they were on, and it led across pretty green meadows and past leafy groves, straight toward the southwest.
emerald_city_of_oz_14_f000013|That looks like a good path, said Omby Amby. Why not try it?|That looks like a good path, said Omby Amby. Why not try it?
emerald_city_of_oz_14_f000014|All right, answered Dorothy. I'm anxious to see what the Rigmaroles are like, and this path ought to take us there the quickest way.|All right, answered Dorothy. I'm anxious to see what the Rigmaroles are like, and this path ought to take us there the quickest way.
emerald_city_of_oz_14_f000015|No one made any objection to this plan, so the Sawhorse turned into the path, which proved to be nearly as good as the one they had taken to get to the Fuddles.|No one made any objection to this plan, so the Sawhorse turned into the path, which proved to be nearly as good as the one they had taken to get to the Fuddles.
emerald_city_of_oz_14_f000016|As first they passed a few retired farm houses, but soon these scattered dwellings were left behind and only the meadows and the trees were before them.|As first they passed a few retired farm houses, but soon these scattered dwellings were left behind and only the meadows and the trees were before them.
emerald_city_of_oz_14_f000017|But they rode along in cheerful contentment, and Aunt Em got into an argument with Billina about the proper way to raise chickens.|But they rode along in cheerful contentment, and Aunt Em got into an argument with Billina about the proper way to raise chickens.
emerald_city_of_oz_14_f000018|I do not care to contradict you, said the Yellow Hen, with dignity, but I have an idea I know more about chickens than human beings do.|I do not care to contradict you, said the Yellow Hen, with dignity, but I have an idea I know more about chickens than human beings do.
emerald_city_of_oz_14_f000019|Pshaw! replied Aunt Em. I've raised chickens for nearly forty years, Billina, and I know you've got to starve 'em to make 'em lay lots of eggs,|Pshaw! replied Aunt Em. I've raised chickens for nearly forty years, Billina, and I know you've got to starve 'em to make 'em lay lots of eggs,
emerald_city_of_oz_14_f000020|and stuff 'em if you want good broilers.|and stuff 'em if you want good broilers.
emerald_city_of_oz_14_f000021|Broilers! exclaimed Billina, in horror. Broil my chickens!|Broilers! exclaimed Billina, in horror. Broil my chickens!
emerald_city_of_oz_14_f000022|Why, that's what they're for, ain't it? asked Aunt Em, astonished.|Why, that's what they're for, ain't it? asked Aunt Em, astonished.
emerald_city_of_oz_14_f000023|No, Aunt, not in Oz, said Dorothy. People do not eat chickens here.|No, Aunt, not in Oz, said Dorothy. People do not eat chickens here.
emerald_city_of_oz_14_f000024|You see, Billina was the first hen that was ever seen in this country, and I brought her here myself. Everybody liked her an' respected her,|You see, Billina was the first hen that was ever seen in this country, and I brought her here myself. Everybody liked her an' respected her,
emerald_city_of_oz_14_f000025|so the Oz people wouldn't any more eat her chickens than they would eat Billina.|so the Oz people wouldn't any more eat her chickens than they would eat Billina.
emerald_city_of_oz_14_f000026|Well, I declare, gasped Aunt Em. How about the eggs?|Well, I declare, gasped Aunt Em. How about the eggs?
emerald_city_of_oz_14_f000027|Oh, if we have more eggs than we want to hatch, we allow people to eat them, said Billina. Indeed, I am very glad the Oz folks like our eggs, for otherwise they would spoil.|Oh, if we have more eggs than we want to hatch, we allow people to eat them, said Billina. Indeed, I am very glad the Oz folks like our eggs, for otherwise they would spoil.
emerald_city_of_oz_14_f000028|This certainly is a queer country, sighed Aunt Em.|This certainly is a queer country, sighed Aunt Em.
emerald_city_of_oz_14_f000029|Excuse me, called the Sawhorse, the path has ended and I'd like to know which way to go.|Excuse me, called the Sawhorse, the path has ended and I'd like to know which way to go.
emerald_city_of_oz_14_f000030|They looked around and sure enough there was no path to be seen.|They looked around and sure enough there was no path to be seen.
emerald_city_of_oz_14_f000031|Well, said Dorothy, we're going southwest, and it seems just as easy to follow that direction without a path as with one.|Well, said Dorothy, we're going southwest, and it seems just as easy to follow that direction without a path as with one.
emerald_city_of_oz_14_f000032|Certainly, answered the Sawhorse. It is not hard to draw the wagon over the meadow. I only want to know where to go.|Certainly, answered the Sawhorse. It is not hard to draw the wagon over the meadow. I only want to know where to go.
emerald_city_of_oz_14_f000033|There's a forest over there across the prairie, said the Wizard, and it lies in the direction we are going. Make straight for the forest, Sawhorse, and you're bound to go right.|There's a forest over there across the prairie, said the Wizard, and it lies in the direction we are going. Make straight for the forest, Sawhorse, and you're bound to go right.
emerald_city_of_oz_14_f000034|So the wooden animal trotted on again and the meadow grass was so soft under the wheels that it made easy riding. But Dorothy was a little uneasy at losing the path,|So the wooden animal trotted on again and the meadow grass was so soft under the wheels that it made easy riding. But Dorothy was a little uneasy at losing the path,
emerald_city_of_oz_14_f000035|because now there was nothing to guide them.|because now there was nothing to guide them.
emerald_city_of_oz_14_f000036|No houses were to be seen at all, so they could not ask their way of any farmer; and although the Land of Oz was always beautiful, wherever one might go,|No houses were to be seen at all, so they could not ask their way of any farmer; and although the Land of Oz was always beautiful, wherever one might go,
emerald_city_of_oz_14_f000037|this part of the country was strange to all the party.|this part of the country was strange to all the party.
emerald_city_of_oz_14_f000038|Perhaps we're lost, suggested Aunt Em, after they had proceeded quite a way in silence.|Perhaps we're lost, suggested Aunt Em, after they had proceeded quite a way in silence.
emerald_city_of_oz_14_f000039|Never mind, said the Shaggy Man; I've been lost many a time and so has Dorothy and we've always been found again.|Never mind, said the Shaggy Man; I've been lost many a time and so has Dorothy and we've always been found again.
emerald_city_of_oz_14_f000040|But we may get hungry, remarked Omby Amby. That is the worst of getting lost in a place where there are no houses near.|But we may get hungry, remarked Omby Amby. That is the worst of getting lost in a place where there are no houses near.
emerald_city_of_oz_14_f000041|We had a good dinner at the Fuddle town, said Uncle Henry, and that will keep us from starving to death for a long time.|We had a good dinner at the Fuddle town, said Uncle Henry, and that will keep us from starving to death for a long time.
emerald_city_of_oz_14_f000042|No one ever starved to death in Oz, declared Dorothy, positively; but people may get pretty hungry sometimes.|No one ever starved to death in Oz, declared Dorothy, positively; but people may get pretty hungry sometimes.
emerald_city_of_oz_14_f000043|The Wizard said nothing, and he did not seem especially anxious. The Sawhorse was trotting along briskly, yet the forest seemed farther away than they had thought when they first saw it.|The Wizard said nothing, and he did not seem especially anxious. The Sawhorse was trotting along briskly, yet the forest seemed farther away than they had thought when they first saw it.
emerald_city_of_oz_14_f000044|So it was nearly sundown when they finally came to the trees; but now they found themselves in a most beautiful spot,|So it was nearly sundown when they finally came to the trees; but now they found themselves in a most beautiful spot,
emerald_city_of_oz_14_f000045|the wide-spreading trees being covered with flowering vines and having soft mosses underneath them.|the wide-spreading trees being covered with flowering vines and having soft mosses underneath them.
emerald_city_of_oz_14_f000046|This will be a good place to camp, said the Wizard, as the Sawhorse stopped for further instructions.|This will be a good place to camp, said the Wizard, as the Sawhorse stopped for further instructions.
emerald_city_of_oz_14_f000047|Camp! they all echoed.|Camp! they all echoed.
emerald_city_of_oz_14_f000048|Certainly, asserted the Wizard. It will be dark before very long and we cannot travel through this forest at night. So let us make a camp here,|Certainly, asserted the Wizard. It will be dark before very long and we cannot travel through this forest at night. So let us make a camp here,
emerald_city_of_oz_14_f000049|and have some supper, and sleep until daylight comes again.|and have some supper, and sleep until daylight comes again.
emerald_city_of_oz_14_f000050|They all looked at the little man in astonishment, and Aunt Em said, with a sniff: A pretty camp we'll have, I must say! I suppose you intend us to sleep under the wagon.|They all looked at the little man in astonishment, and Aunt Em said, with a sniff: A pretty camp we'll have, I must say! I suppose you intend us to sleep under the wagon.
emerald_city_of_oz_14_f000051|And chew grass for our supper, added the Shaggy Man, laughing.|And chew grass for our supper, added the Shaggy Man, laughing.
emerald_city_of_oz_14_f000052|But Dorothy seemed to have no doubts and was quite cheerful It's lucky we have the wonderful Wizard with us, she said; because he can do 'most anything he wants to.|But Dorothy seemed to have no doubts and was quite cheerful It's lucky we have the wonderful Wizard with us, she said; because he can do 'most anything he wants to.
