emerald_city_of_oz_07_f000089|Try it, Em, he returned, also in a whisper. Look at him as you do at me when I'm late to dinner.|Try it, Em, he returned, also in a whisper. Look at him as you do at me when I'm late to dinner.
emerald_city_of_oz_07_f000090|Aunt Em turned upon the Lion a determined countenance and a wild dilated eye. She glared at the immense beast steadily, and the Lion, who had been quietly blinking at them,|Aunt Em turned upon the Lion a determined countenance and a wild dilated eye. She glared at the immense beast steadily, and the Lion, who had been quietly blinking at them,
emerald_city_of_oz_07_f000091|began to appear uneasy and disturbed.|began to appear uneasy and disturbed.
emerald_city_of_oz_07_f000092|Is anything the matter, ma'am? he asked, in a mild voice.|Is anything the matter, ma'am? he asked, in a mild voice.
emerald_city_of_oz_07_f000093|At this speech from the terrible beast Aunt Em and Uncle Henry both were startled, and then Uncle Henry remembered that this must be the Lion they had seen in Ozma's Throne Room.|At this speech from the terrible beast Aunt Em and Uncle Henry both were startled, and then Uncle Henry remembered that this must be the Lion they had seen in Ozma's Throne Room.
emerald_city_of_oz_07_f000094|Hold on, Em! he exclaimed. Quit the eagle eye conquest an' take courage. I guess this is the same Cowardly Lion Dorothy has told us about.|Hold on, Em! he exclaimed. Quit the eagle eye conquest an' take courage. I guess this is the same Cowardly Lion Dorothy has told us about.
emerald_city_of_oz_07_f000095|Oh, is it? she cried, much relieved.|Oh, is it? she cried, much relieved.
emerald_city_of_oz_07_f000096|When he spoke, I got the idea; and when he looked so 'shamed like, I was sure of it, Uncle Henry continued.|When he spoke, I got the idea; and when he looked so 'shamed like, I was sure of it, Uncle Henry continued.
emerald_city_of_oz_07_f000097|Aunt Em regarded the animal with new interest.|Aunt Em regarded the animal with new interest.
emerald_city_of_oz_07_f000098|Are you the Cowardly Lion? she inquired. Are you Dorothy's friend?|Are you the Cowardly Lion? she inquired. Are you Dorothy's friend?
emerald_city_of_oz_07_f000099|Yes'm, answered the Lion, meekly. Dorothy and I are old chums and are very fond of each other. I'm the King of Beasts, you know, and the Hungry Tiger and I serve Princess Ozma as her body guards.|Yes'm, answered the Lion, meekly. Dorothy and I are old chums and are very fond of each other. I'm the King of Beasts, you know, and the Hungry Tiger and I serve Princess Ozma as her body guards.
emerald_city_of_oz_07_f000100|To be sure, said Aunt Em, nodding. But the King of Beasts shouldn't be cowardly.|To be sure, said Aunt Em, nodding. But the King of Beasts shouldn't be cowardly.
emerald_city_of_oz_07_f000101|I've heard that said before, remarked the Lion, yawning till he showed two great rows of sharp white teeth; but that does not keep me from being frightened whenever I go into battle.|I've heard that said before, remarked the Lion, yawning till he showed two great rows of sharp white teeth; but that does not keep me from being frightened whenever I go into battle.
emerald_city_of_oz_07_f000102|What do you do, run? asked Uncle Henry.|What do you do, run? asked Uncle Henry.
emerald_city_of_oz_07_f000103|No; that would be foolish, for the enemy would run after me, declared the Lion. So I tremble with fear and pitch in as hard as I can; and so far I have always won my fight.|No; that would be foolish, for the enemy would run after me, declared the Lion. So I tremble with fear and pitch in as hard as I can; and so far I have always won my fight.
emerald_city_of_oz_07_f000104|Ah, I begin to understand, said Uncle Henry.|Ah, I begin to understand, said Uncle Henry.
emerald_city_of_oz_07_f000105|Were you scared when I looked at you just now? inquired Aunt Em.|Were you scared when I looked at you just now? inquired Aunt Em.
emerald_city_of_oz_07_f000106|Terribly scared, madam, answered the Lion, for at first I thought you were going to have a fit. Then I noticed you were trying to overcome me by the power of your eye,|Terribly scared, madam, answered the Lion, for at first I thought you were going to have a fit. Then I noticed you were trying to overcome me by the power of your eye,
emerald_city_of_oz_07_f000107|and your glance was so fierce and penetrating that I shook with fear.|and your glance was so fierce and penetrating that I shook with fear.
emerald_city_of_oz_07_f000108|This greatly pleased the lady, and she said quite cheerfully: Well, I won't hurt you, so don't be scared any more. I just wanted to see what the human eye was good for.|This greatly pleased the lady, and she said quite cheerfully: Well, I won't hurt you, so don't be scared any more. I just wanted to see what the human eye was good for.
emerald_city_of_oz_07_f000109|The human eye is a fearful weapon, remarked the Lion, scratching his nose softly with his paw to hide a smile.|The human eye is a fearful weapon, remarked the Lion, scratching his nose softly with his paw to hide a smile.
emerald_city_of_oz_07_f000110|Had I not known you were Dorothy's friends I might have torn you both into shreds in order to escape your terrible gaze.|Had I not known you were Dorothy's friends I might have torn you both into shreds in order to escape your terrible gaze.
emerald_city_of_oz_07_f000111|Aunt Em shuddered at hearing this, and Uncle Henry said hastily: I'm glad you knew us. Good morning, Mr. Lion; we'll hope to see you again by and by some time in the future.|Aunt Em shuddered at hearing this, and Uncle Henry said hastily: I'm glad you knew us. Good morning, Mr. Lion; we'll hope to see you again by and by some time in the future.
emerald_city_of_oz_07_f000112|Good morning, replied the Lion, squatting down upon the lawn again.|Good morning, replied the Lion, squatting down upon the lawn again.
emerald_city_of_oz_07_f000113|You are likely to see a good deal of me, if you live in the Land of Oz.|You are likely to see a good deal of me, if you live in the Land of Oz.
emerald_city_of_oz_07_f000114|End of chapter 7.|End of chapter seven.
emerald_city_of_oz_08_f000001|This is there librivox re cording. All librivox recordings are in the public domain. For more information or to volunteer please visit librivox dot org.|This is there librivox re cording. All librivox recordings are in the public domain. For more information or to volunteer please visit librivox dot org.
emerald_city_of_oz_08_f000002|The The Emerald City of Oz by L Frank Baum. Chapter 8. How the Grand Gallipoot Joined The Nomes.|The The Emerald City of Oz by L Frank Baum. Chapter eight. How the Grand Gallipoot Joined The Nomes.
emerald_city_of_oz_08_f000003|After leaving the Whimsies, Guph continued on his journey and penetrated far into the Northwest. He wanted to get to the Country of the Growleywogs,|After leaving the Whimsies, Guph continued on his journey and penetrated far into the Northwest. He wanted to get to the Country of the Growleywogs,
emerald_city_of_oz_08_f000004|and in order to do that he must cross the Ripple Land, which was a hard thing to do.|and in order to do that he must cross the Ripple Land, which was a hard thing to do.
emerald_city_of_oz_08_f000005|For the Ripple Land was a succession of hills and valleys, all very steep and rocky, and they changed places constantly by rippling.|For the Ripple Land was a succession of hills and valleys, all very steep and rocky, and they changed places constantly by rippling.
emerald_city_of_oz_08_f000006|While Guph was climbing a hill it sank down under him and became a valley,|While Guph was climbing a hill it sank down under him and became a valley,
emerald_city_of_oz_08_f000007|and while he was descending into a valley it rose up and carried him to the top of a hill. This was very perplexing to the traveler,|and while he was descending into a valley it rose up and carried him to the top of a hill. This was very perplexing to the traveler,
emerald_city_of_oz_08_f000008|and a stranger might have thought he could never cross the Ripple Land at all.|and a stranger might have thought he could never cross the Ripple Land at all.
emerald_city_of_oz_08_f000009|But Guph knew that if he kept steadily on he would get to the end at last; so he paid no attention to the changing hills and valleys and plodded along as calmly as if walking upon the level ground.|But Guph knew that if he kept steadily on he would get to the end at last; so he paid no attention to the changing hills and valleys and plodded along as calmly as if walking upon the level ground.
emerald_city_of_oz_08_f000010|The result of this wise persistence was that the General finally reached firmer soil and, after penetrating a dense forest, came to the Dominion of the Growleywogs.|The result of this wise persistence was that the General finally reached firmer soil and, after penetrating a dense forest, came to the Dominion of the Growleywogs.
emerald_city_of_oz_08_f000011|No sooner had he crossed the border of this domain when two guards seized him and carried him before the Grand Gallipoot of the Growleywogs,|No sooner had he crossed the border of this domain when two guards seized him and carried him before the Grand Gallipoot of the Growleywogs,
emerald_city_of_oz_08_f000012|who scowled upon him ferociously and asked him why he dared intrude upon his territory.|who scowled upon him ferociously and asked him why he dared intrude upon his territory.
emerald_city_of_oz_08_f000013|I'm the Lord High General of the Invincible Army of the Nomes, and my name is Guph, was the reply. All the world trembles when that name is mentioned.|I'm the Lord High General of the Invincible Army of the Nomes, and my name is Guph, was the reply. All the world trembles when that name is mentioned.
emerald_city_of_oz_08_f000014|The Growleywogs gave a shout of jeering laughter at this, and one of them caught the Nome in his strong arms and tossed him high into the air.|The Growleywogs gave a shout of jeering laughter at this, and one of them caught the Nome in his strong arms and tossed him high into the air.
emerald_city_of_oz_08_f000015|Guph was considerably shaken when he fell upon the hard ground, but he appeared to take no notice of the impertinence and composed himself to speak again to the Grand Gallipoot.|Guph was considerably shaken when he fell upon the hard ground, but he appeared to take no notice of the impertinence and composed himself to speak again to the Grand Gallipoot.
emerald_city_of_oz_08_f000016|My master, King Roquat the Red, has sent me here to confer with you.|My master, King Roquat the Red, has sent me here to confer with you.
emerald_city_of_oz_08_f000017|He wishes your assistance to conquer the Land of Oz.|He wishes your assistance to conquer the Land of Oz.
emerald_city_of_oz_08_f000018|Here the General paused, and the Grand Gallipoot scowled upon him more terribly than ever and said: Go on!|Here the General paused, and the Grand Gallipoot scowled upon him more terribly than ever and said: Go on!
emerald_city_of_oz_08_f000019|The voice of the Grand Gallipoot was partly a roar and partly a growl.|The voice of the Grand Gallipoot was partly a roar and partly a growl.
emerald_city_of_oz_08_f000020|He mumbled his words badly and Guph had to listen carefully in order to understand him.|He mumbled his words badly and Guph had to listen carefully in order to understand him.
emerald_city_of_oz_08_f000021|These Growleywogs were certainly remarkable creatures. They were of gigantic size, yet were all bone and skin and muscle, there being no meat or fat upon their bodies at all.|These Growleywogs were certainly remarkable creatures. They were of gigantic size, yet were all bone and skin and muscle, there being no meat or fat upon their bodies at all.
emerald_city_of_oz_08_f000022|Their powerful muscles lay just underneath their skins, like bunches of tough rope, and the weakest Growleywog was so strong that he could pick up an elephant and toss it seven miles away.|Their powerful muscles lay just underneath their skins, like bunches of tough rope, and the weakest Growleywog was so strong that he could pick up an elephant and toss it seven miles away.
emerald_city_of_oz_08_f000023|It seems unfortunate that strong people are usually so disagreeable and overbearing that no one cares for them. In fact, to be different from your fellow creatures is always a misfortune.|It seems unfortunate that strong people are usually so disagreeable and overbearing that no one cares for them. In fact, to be different from your fellow creatures is always a misfortune.
emerald_city_of_oz_08_f000024|The Growleywogs knew that they were disliked and avoided by every one, so they had become surly and unsociable even among themselves. Guph knew that they hated all people, including the Nomes;|The Growleywogs knew that they were disliked and avoided by every one, so they had become surly and unsociable even among themselves. Guph knew that they hated all people, including the Nomes;
emerald_city_of_oz_08_f000025|but he hoped to win them over, nevertheless, and knew that if he succeeded they would afford him very powerful assistance.|but he hoped to win them over, nevertheless, and knew that if he succeeded they would afford him very powerful assistance.
emerald_city_of_oz_08_f000026|The Land of Oz is ruled by a namby-pamby girl who is disgustingly kind and good, he continued. Her people are all happy and contented and have no care or worries whatever.|The Land of Oz is ruled by a namby-pamby girl who is disgustingly kind and good, he continued. Her people are all happy and contented and have no care or worries whatever.
emerald_city_of_oz_08_f000027|Go on! growled the Grand Gallipoot.|Go on! growled the Grand Gallipoot.
emerald_city_of_oz_08_f000028|Once the Nome King enslaved the Royal Family of Ev another goody-goody lot that we detest, said the General. But Ozma interfered, although it was none of her business,|Once the Nome King enslaved the Royal Family of Ev another goody-goody lot that we detest, said the General. But Ozma interfered, although it was none of her business,
emerald_city_of_oz_08_f000029|and marched her army against us.|and marched her army against us.
emerald_city_of_oz_08_f000030|With her was a Kansas girl named Dorothy, and a Yellow Hen, and they marched directly into the Nome King's cavern. There they liberated our slaves from Ev and stole King Roquat's Magic Belt,|With her was a Kansas girl named Dorothy, and a Yellow Hen, and they marched directly into the Nome King's cavern. There they liberated our slaves from Ev and stole King Roquat's Magic Belt,
emerald_city_of_oz_08_f000031|which they carried away with them.|which they carried away with them.
emerald_city_of_oz_08_f000032|So now our King is making a tunnel under the deadly desert, so we can march through it to the Emerald City.|So now our King is making a tunnel under the deadly desert, so we can march through it to the Emerald City.
emerald_city_of_oz_08_f000033|When we get there we mean to conquer and destroy all the land and recapture the Magic Belt.|When we get there we mean to conquer and destroy all the land and recapture the Magic Belt.
emerald_city_of_oz_08_f000034|Again he paused, and again the Grand Gallipoot growled: Go on!|Again he paused, and again the Grand Gallipoot growled: Go on!
emerald_city_of_oz_08_f000035|Guph tried to think what to say next, and a happy thought soon occurred to him.|Guph tried to think what to say next, and a happy thought soon occurred to him.
emerald_city_of_oz_08_f000036|We want you to help us in this conquest, he announced, for we need the mighty aid of the Growleywogs in order to make sure that we shall not be defeated.|We want you to help us in this conquest, he announced, for we need the mighty aid of the Growleywogs in order to make sure that we shall not be defeated.
emerald_city_of_oz_08_f000037|You are the strongest people in all the world, and you hate good and happy creatures as much as we Nomes do. I am sure it will be a real pleasure to you to tear down the beautiful Emerald City,|You are the strongest people in all the world, and you hate good and happy creatures as much as we Nomes do. I am sure it will be a real pleasure to you to tear down the beautiful Emerald City,
emerald_city_of_oz_08_f000038|and in return for your valuable assistance we will allow you to bring back to your country ten thousand people of Oz, to be your slaves.|and in return for your valuable assistance we will allow you to bring back to your country ten thousand people of Oz, to be your slaves.
emerald_city_of_oz_08_f000039|Twenty thousand! growled the Grand Gallipoot.|Twenty thousand! growled the Grand Gallipoot.
emerald_city_of_oz_08_f000040|All right, we promise you twenty thousand, agreed the General.|All right, we promise you twenty thousand, agreed the General.
emerald_city_of_oz_08_f000041|The Gallipoot made a signal and at once his attendants picked up General Guph and carried him away to a prison, where the jailer amused himself by sticking pins in the round fat body of the old Nome,|The Gallipoot made a signal and at once his attendants picked up General Guph and carried him away to a prison, where the jailer amused himself by sticking pins in the round fat body of the old Nome,
emerald_city_of_oz_08_f000042|to see him jump and hear him yell.|to see him jump and hear him yell.
emerald_city_of_oz_08_f000043|But while this was going on the Grand Gallipoot was talking with his counselors, who were the most important officials of the Growleywogs.|But while this was going on the Grand Gallipoot was talking with his counselors, who were the most important officials of the Growleywogs.
emerald_city_of_oz_08_f000044|When he had stated to them the proposition of the Nome King, he said: My advice is to offer to help them. Then, when we have conquered the Land of Oz,|When he had stated to them the proposition of the Nome King, he said: My advice is to offer to help them. Then, when we have conquered the Land of Oz,
emerald_city_of_oz_08_f000045|we will take not only our twenty thousand prisoners but all the gold and jewels we want.|we will take not only our twenty thousand prisoners but all the gold and jewels we want.
emerald_city_of_oz_08_f000046|Let us take the Magic Belt, too, suggested one counselor.|Let us take the Magic Belt, too, suggested one counselor.
emerald_city_of_oz_08_f000047|And rob the Nome King and make him our slave, said another.|And rob the Nome King and make him our slave, said another.
emerald_city_of_oz_08_f000048|That is a good idea, declared the Grand Gallipoot. I'd like King Roquat for my own slave. He could black my boots and bring me my porridge every morning while I am in bed.|That is a good idea, declared the Grand Gallipoot. I'd like King Roquat for my own slave. He could black my boots and bring me my porridge every morning while I am in bed.
emerald_city_of_oz_08_f000049|There is a famous Scarecrow in Oz. I'll take him for my slave, said a counselor.|There is a famous Scarecrow in Oz. I'll take him for my slave, said a counselor.
emerald_city_of_oz_08_f000050|I'll take Tiktok, the machine man, said another.|I'll take Tiktok, the machine man, said another.
emerald_city_of_oz_08_f000051|Give me the Tin Woodman, said a third.|Give me the Tin Woodman, said a third.
emerald_city_of_oz_08_f000052|They went on for some time, dividing up the people and the treasure of Oz in advance of the conquest. For they had no doubt at all that they would be able to destroy Ozma's domain.|They went on for some time, dividing up the people and the treasure of Oz in advance of the conquest. For they had no doubt at all that they would be able to destroy Ozma's domain.
emerald_city_of_oz_08_f000053|Were they not the strongest people in all the world?|Were they not the strongest people in all the world?
emerald_city_of_oz_08_f000054|The deadly desert has kept us out of Oz before, remarked the Grand Gallipoot, but now that the Nome King is building a tunnel we shall get into the Emerald City very easily.|The deadly desert has kept us out of Oz before, remarked the Grand Gallipoot, but now that the Nome King is building a tunnel we shall get into the Emerald City very easily.
emerald_city_of_oz_08_f000055|So let us send the little fat General back to his King with our promise to assist him. We will not say that we intend to conquer the Nomes after we have conquered Oz,|So let us send the little fat General back to his King with our promise to assist him. We will not say that we intend to conquer the Nomes after we have conquered Oz,
emerald_city_of_oz_08_f000056|but we will do so, just the same.|but we will do so, just the same.
emerald_city_of_oz_08_f000057|This plan being agreed upon, they all went home to dinner, leaving General Guph still in prison. The Nome had no idea that he had succeeded in his mission,|This plan being agreed upon, they all went home to dinner, leaving General Guph still in prison. The Nome had no idea that he had succeeded in his mission,
emerald_city_of_oz_08_f000058|for finding himself in prison he feared the Growleywogs intended to put him to death.|for finding himself in prison he feared the Growleywogs intended to put him to death.
emerald_city_of_oz_08_f000059|By this time the jailer had tired of sticking pins in the General, and was amusing himself by carefully pulling the Nome's whiskers out by the roots, one at a time.|By this time the jailer had tired of sticking pins in the General, and was amusing himself by carefully pulling the Nome's whiskers out by the roots, one at a time.
emerald_city_of_oz_08_f000060|This enjoyment was interrupted by the Grand Gallipoot sending for the prisoner.|This enjoyment was interrupted by the Grand Gallipoot sending for the prisoner.
emerald_city_of_oz_08_f000061|Wait a few hours, begged the jailer. I haven't pulled out a quarter of his whiskers yet.|Wait a few hours, begged the jailer. I haven't pulled out a quarter of his whiskers yet.
emerald_city_of_oz_08_f000062|If you keep the Grand Gallipoot waiting, he'll break your back, declared the messenger.|If you keep the Grand Gallipoot waiting, he'll break your back, declared the messenger.
emerald_city_of_oz_08_f000063|Perhaps you're right, sighed the jailer. Take the prisoner away, if you will, but I advise you to kick him at every step he takes. It will be good fun,|Perhaps you're right, sighed the jailer. Take the prisoner away, if you will, but I advise you to kick him at every step he takes. It will be good fun,
emerald_city_of_oz_08_f000064|for he is as soft as a ripe peach.|for he is as soft as a ripe peach.
emerald_city_of_oz_08_f000065|So Guph was led away to the royal castle, where the Grand Gallipoot told him that the Growleywogs had decided to assist the Nomes in conquering the Land of Oz.|So Guph was led away to the royal castle, where the Grand Gallipoot told him that the Growleywogs had decided to assist the Nomes in conquering the Land of Oz.
emerald_city_of_oz_08_f000066|Whenever you are ready, he added, send me word and I will march with eighteen thousand of my most powerful warriors to your aid.|Whenever you are ready, he added, send me word and I will march with eighteen thousand of my most powerful warriors to your aid.
emerald_city_of_oz_08_f000067|Guph was so delighted that he forgot all the smarting caused by the pins and the pulling of whiskers. He did not even complain of the treatment he had received,|Guph was so delighted that he forgot all the smarting caused by the pins and the pulling of whiskers. He did not even complain of the treatment he had received,
emerald_city_of_oz_08_f000068|but thanked the Grand Gallipoot and hurried away upon his journey.|but thanked the Grand Gallipoot and hurried away upon his journey.
emerald_city_of_oz_08_f000069|He had now secured the assistance of the Whimsies and the Growleywogs; but his success made him long for still more allies. His own life depended upon his conquering Oz,|He had now secured the assistance of the Whimsies and the Growleywogs; but his success made him long for still more allies. His own life depended upon his conquering Oz,
emerald_city_of_oz_08_f000070|and he said to himself: I'll take no chances.|and he said to himself: I'll take no chances.
emerald_city_of_oz_08_f000071|I'll be certain of success. Then, when Oz is destroyed, perhaps I shall be a greater man than old Roquat, and I can throw him away and be King of the Nomes myself.|I'll be certain of success. Then, when Oz is destroyed, perhaps I shall be a greater man than old Roquat, and I can throw him away and be King of the Nomes myself.
emerald_city_of_oz_08_f000072|Why not? The Whimsies are stronger than the Nomes, and they also are my friends. There are some people still stronger than the Growleywogs,|Why not? The Whimsies are stronger than the Nomes, and they also are my friends. There are some people still stronger than the Growleywogs,
emerald_city_of_oz_08_f000073|and if I can but induce them to aid me I shall have nothing more to fear.|and if I can but induce them to aid me I shall have nothing more to fear.
emerald_city_of_oz_08_f000074|End of chapter 8.|End of chapter eight.
emerald_city_of_oz_09_f000001|This is there librivox re cording. All librivox recordings are in the public domain. For more information or to volunteer please visit librivox dot org.|This is there librivox re cording. All librivox recordings are in the public domain. For more information or to volunteer please visit librivox dot org.
emerald_city_of_oz_09_f000002|The The Emerald City of Oz by L Frank Baum. Chapter 9. How the Wogglebug Taught Athletics.|The The Emerald City of Oz by L Frank Baum. Chapter nine. How the Wogglebug Taught Athletics.
