emerald_city_of_oz_01_f000001|This is there librivox recording. All librivox recordings are in the public domain. For more information or to volunteer please visit librivox dot org.|This is there librivox recording. All librivox recordings are in the public domain. For more information or to volunteer please visit librivox dot org.
emerald_city_of_oz_01_f000002|The The Emerald City of Oz by L Frank Baum. Perhaps I should admit on the title page that this book is By L Frank Baum and his correspondents,|The The Emerald City of Oz by L Frank Baum. Perhaps I should admit on the title page that this book is By L Frank Baum and his correspondents,
emerald_city_of_oz_01_f000003|for I have used many suggestions conveyed to me in letters from children. Once on a time I really imagined myself an author of fairy tales,|for I have used many suggestions conveyed to me in letters from children. Once on a time I really imagined myself an author of fairy tales,
emerald_city_of_oz_01_f000004|but now I am merely an editor or private secretary for a host of youngsters whose ideas I am requestsed to weave into the thread of my stories.|but now I am merely an editor or private secretary for a host of youngsters whose ideas I am requestsed to weave into the thread of my stories.
emerald_city_of_oz_01_f000005|These ideas are often clever. They are also logical and interesting.|These ideas are often clever. They are also logical and interesting.
emerald_city_of_oz_01_f000006|So I have used them whenever I could find an opportunity, and it is but just that I acknowledge my indebtedness to my little friends.|So I have used them whenever I could find an opportunity, and it is but just that I acknowledge my indebtedness to my little friends.
emerald_city_of_oz_01_f000007|My, what imaginations these children have developed! Sometimes I am fairly astounded by their daring and genius. There will be no lack of fairy-tale authors in the future, I am sure.|My, what imaginations these children have developed! Sometimes I am fairly astounded by their daring and genius. There will be no lack of fairy-tale authors in the future, I am sure.
emerald_city_of_oz_01_f000008|My readers have told me what to do with Dorothy, and Aunt Em and Uncle Henry, and I have obeyed their mandates. They have also given me a variety of subjects to write about in the future:|My readers have told me what to do with Dorothy, and Aunt Em and Uncle Henry, and I have obeyed their mandates. They have also given me a variety of subjects to write about in the future:
emerald_city_of_oz_01_f000009|enough, in fact, to keep me busy for some time.|enough, in fact, to keep me busy for some time.
emerald_city_of_oz_01_f000010|I am very proud of this alliance. Children love these stories because children have helped to create them. My readers know what they want and realize that I try to please them.|I am very proud of this alliance. Children love these stories because children have helped to create them. My readers know what they want and realize that I try to please them.
emerald_city_of_oz_01_f000011|The result is very satisfactory to the publishers, to me, and I am quite sure to the children.|The result is very satisfactory to the publishers, to me, and I am quite sure to the children.
emerald_city_of_oz_01_f000012|I hope, my dears, it will be a long time before we are obliged to dissolve partnership.|I hope, my dears, it will be a long time before we are obliged to dissolve partnership.
emerald_city_of_oz_01_f000013|L Frank BAUM. Coronado, 1910.|L Frank BAUM. Coronado, nineteen ten.
emerald_city_of_oz_01_f000014|Chapter 1. How the Nome King Became Angry.|Chapter one. How the Nome King Became Angry.
emerald_city_of_oz_01_f000015|The Nome King was in an angry mood, and at such times he was very disagreeable. Every one kept away from him, even his Chief Steward Kaliko.|The Nome King was in an angry mood, and at such times he was very disagreeable. Every one kept away from him, even his Chief Steward Kaliko.
emerald_city_of_oz_01_f000016|Therefore the King stormed and raved all by himself, walking up and down in his jewel-studded cavern and getting angrier all the time.|Therefore the King stormed and raved all by himself, walking up and down in his jewel-studded cavern and getting angrier all the time.
emerald_city_of_oz_01_f000017|Then he remembered that it was no fun being angry unless he had some one to frighten and make miserable, and he rushed to his big gong and made it clatter as loud as he could.|Then he remembered that it was no fun being angry unless he had some one to frighten and make miserable, and he rushed to his big gong and made it clatter as loud as he could.
emerald_city_of_oz_01_f000018|In came the Chief Steward, trying not to show the Nome King how frightened he was.|In came the Chief Steward, trying not to show the Nome King how frightened he was.
emerald_city_of_oz_01_f000019|Send the Chief Counselor here! shouted the angry monarch.|Send the Chief Counselor here! shouted the angry monarch.
emerald_city_of_oz_01_f000020|Kaliko ran out as fast as his spindle legs could carry his fat, round body, and soon the Chief Counselor entered the cavern. The King scowled and said to him:|Kaliko ran out as fast as his spindle legs could carry his fat, round body, and soon the Chief Counselor entered the cavern. The King scowled and said to him:
emerald_city_of_oz_01_f000021|I'm in great trouble over the loss of my Magic Belt.|I'm in great trouble over the loss of my Magic Belt.
emerald_city_of_oz_01_f000022|Every little while I want to do something magical, and find I can't because the Belt is gone. That makes me angry, and when I'm angry I can't have a good time. Now, what do you advise?|Every little while I want to do something magical, and find I can't because the Belt is gone. That makes me angry, and when I'm angry I can't have a good time. Now, what do you advise?
emerald_city_of_oz_01_f000023|Some people, said the Chief Counselor, enjoy getting angry.|Some people, said the Chief Counselor, enjoy getting angry.
emerald_city_of_oz_01_f000024|But not all the time, declared the King. To be angry once in a while is really good fun, because it makes others so miserable. But to be angry morning,|But not all the time, declared the King. To be angry once in a while is really good fun, because it makes others so miserable. But to be angry morning,
emerald_city_of_oz_01_f000025|noon and night, as I am, grows monotonous and prevents my gaining any other pleasure in life. Now what do you advise?|noon and night, as I am, grows monotonous and prevents my gaining any other pleasure in life. Now what do you advise?
emerald_city_of_oz_01_f000026|Why, if you are angry because you want to do magical things and can't, and if you don't want to get angry at all, my advice is not to want to do magical things.|Why, if you are angry because you want to do magical things and can't, and if you don't want to get angry at all, my advice is not to want to do magical things.
emerald_city_of_oz_01_f000027|Hearing this, the King glared at his Counselor with a furious expression and tugged at his own long white whiskers until he pulled them so hard that he yelled with pain.|Hearing this, the King glared at his Counselor with a furious expression and tugged at his own long white whiskers until he pulled them so hard that he yelled with pain.
emerald_city_of_oz_01_f000028|You are a fool! he exclaimed.|You are a fool! he exclaimed.
emerald_city_of_oz_01_f000029|I share that honor with your Majesty, said the Chief Counselor.|I share that honor with your Majesty, said the Chief Counselor.
emerald_city_of_oz_01_f000030|The King roared with rage and stamped his foot.|The King roared with rage and stamped his foot.
emerald_city_of_oz_01_f000031|Ho, there, my guards! he cried. Ho is a royal way of saying, Come here. So, when the guards had hoed, the King said to them: Take this Chief Counselor and throw him away.|Ho, there, my guards! he cried. Ho is a royal way of saying, Come here. So, when the guards had hoed, the King said to them: Take this Chief Counselor and throw him away.
emerald_city_of_oz_01_f000032|Then the guards took the Chief Counselor, and bound him with chains to prevent his struggling, and threw him away. And the King paced up and down his cavern more angry than before.|Then the guards took the Chief Counselor, and bound him with chains to prevent his struggling, and threw him away. And the King paced up and down his cavern more angry than before.
emerald_city_of_oz_01_f000033|Finally he rushed to his big gong and made it clatter like a fire alarm. Kaliko appeared again, trembling and white with fear.|Finally he rushed to his big gong and made it clatter like a fire alarm. Kaliko appeared again, trembling and white with fear.
emerald_city_of_oz_01_f000034|Fetch my pipe! yelled the King.|Fetch my pipe! yelled the King.
emerald_city_of_oz_01_f000035|Your pipe is already here, your Majesty, replied Kaliko.|Your pipe is already here, your Majesty, replied Kaliko.
emerald_city_of_oz_01_f000036|Then get my tobacco! roared the King.|Then get my tobacco! roared the King.
emerald_city_of_oz_01_f000037|The tobacco is in your pipe, your Majesty, returned the Steward.|The tobacco is in your pipe, your Majesty, returned the Steward.
emerald_city_of_oz_01_f000038|Then bring a live coal from the furnace! commanded the King.|Then bring a live coal from the furnace! commanded the King.
emerald_city_of_oz_01_f000039|The tobacco is lighted, and your Majesty is already smoking your pipe, answered the Steward.|The tobacco is lighted, and your Majesty is already smoking your pipe, answered the Steward.
emerald_city_of_oz_01_f000040|Why, so I am! said the King, who had forgotten this fact; but you are very rude to remind me of it.|Why, so I am! said the King, who had forgotten this fact; but you are very rude to remind me of it.
emerald_city_of_oz_01_f000041|I am a lowborn, miserable villain, declared the Chief Steward, humbly.|I am a lowborn, miserable villain, declared the Chief Steward, humbly.
emerald_city_of_oz_01_f000042|The Nome King could think of nothing to say next, so he puffed away at his pipe and paced up and down the room. Finally, he remembered how angry he was, and cried out:|The Nome King could think of nothing to say next, so he puffed away at his pipe and paced up and down the room. Finally, he remembered how angry he was, and cried out:
emerald_city_of_oz_01_f000043|What do you mean, Kaliko, by being so contented when your monarch is unhappy?|What do you mean, Kaliko, by being so contented when your monarch is unhappy?
emerald_city_of_oz_01_f000044|What makes you unhappy? asked the Steward.|What makes you unhappy? asked the Steward.
emerald_city_of_oz_01_f000045|I've lost my Magic Belt. A little girl named Dorothy, who was here with Ozma of Oz, stole my Belt and carried it away with her, said the King, grinding his teeth with rage.|I've lost my Magic Belt. A little girl named Dorothy, who was here with Ozma of Oz, stole my Belt and carried it away with her, said the King, grinding his teeth with rage.
emerald_city_of_oz_01_f000046|She captured it in a fair fight, Kaliko ventured to say.|She captured it in a fair fight, Kaliko ventured to say.
emerald_city_of_oz_01_f000047|But I want it! I must have it! Half my power is gone with that Belt! roared the King.|But I want it! I must have it! Half my power is gone with that Belt! roared the King.
emerald_city_of_oz_01_f000048|You will have to go to the Land of Oz to recover it, and your Majesty can't get to the Land of Oz in any possible way, said the Steward, yawning because he had been on duty ninety-six hours, and was sleepy.|You will have to go to the Land of Oz to recover it, and your Majesty can't get to the Land of Oz in any possible way, said the Steward, yawning because he had been on duty ninety-six hours, and was sleepy.
emerald_city_of_oz_01_f000049|Why not? asked the King.|Why not? asked the King.
emerald_city_of_oz_01_f000050|Because there is a deadly desert all around that fairy country, which no one is able to cross. You know that fact as well as I do, your Majesty.|Because there is a deadly desert all around that fairy country, which no one is able to cross. You know that fact as well as I do, your Majesty.
emerald_city_of_oz_01_f000051|Never mind the lost Belt. You have plenty of power left, for you rule this underground kingdom like a tyrant, and thousands of Nomes obey your commands.|Never mind the lost Belt. You have plenty of power left, for you rule this underground kingdom like a tyrant, and thousands of Nomes obey your commands.
emerald_city_of_oz_01_f000052|I advise you to drink a glass of melted silver, to quiet your nerves, and then go to bed.|I advise you to drink a glass of melted silver, to quiet your nerves, and then go to bed.
emerald_city_of_oz_01_f000053|The King grabbed a big ruby and threw it at Kaliko's head. The Steward ducked to escape the heavy jewel, which crashed against the door just over his left ear.|The King grabbed a big ruby and threw it at Kaliko's head. The Steward ducked to escape the heavy jewel, which crashed against the door just over his left ear.
emerald_city_of_oz_01_f000054|Get out of my sight! Vanish! Go away and send General Blug here, screamed the Nome King.|Get out of my sight! Vanish! Go away and send General Blug here, screamed the Nome King.
emerald_city_of_oz_01_f000055|Kaliko hastily withdrew, and the Nome King stamped up and down until the General of his armies appeared.|Kaliko hastily withdrew, and the Nome King stamped up and down until the General of his armies appeared.
emerald_city_of_oz_01_f000056|This Nome was known far and wide as a terrible fighter and a cruel, desperate commander. He had fifty thousand Nome soldiers, all well drilled,|This Nome was known far and wide as a terrible fighter and a cruel, desperate commander. He had fifty thousand Nome soldiers, all well drilled,
emerald_city_of_oz_01_f000057|who feared nothing but their stern master.|who feared nothing but their stern master.
emerald_city_of_oz_01_f000058|Yet General Blug was a trifle uneasy when he arrived and saw how angry the Nome King was.|Yet General Blug was a trifle uneasy when he arrived and saw how angry the Nome King was.
emerald_city_of_oz_01_f000059|Ha! So you're here! cried the King.|Ha! So you're here! cried the King.
emerald_city_of_oz_01_f000060|So I am, said the General.|So I am, said the General.
emerald_city_of_oz_01_f000061|March your army at once to the Land of Oz, capture and destroy the Emerald City, and bring back to me my Magic Belt! roared the King.|March your army at once to the Land of Oz, capture and destroy the Emerald City, and bring back to me my Magic Belt! roared the King.
emerald_city_of_oz_01_f000062|You're crazy, calmly remarked the General.|You're crazy, calmly remarked the General.
emerald_city_of_oz_01_f000063|What's that? What's that? What's that? And the Nome King danced around on his pointed toes, he was so enraged.|What's that? What's that? What's that? And the Nome King danced around on his pointed toes, he was so enraged.
emerald_city_of_oz_01_f000064|You don't know what you're talking about, continued the General, seating himself upon a large cut diamond. I advise you to stand in a corner and count sixty before you speak again.|You don't know what you're talking about, continued the General, seating himself upon a large cut diamond. I advise you to stand in a corner and count sixty before you speak again.
emerald_city_of_oz_01_f000065|By that time you may be more sensible.|By that time you may be more sensible.
emerald_city_of_oz_01_f000066|The King looked around for something to throw at General Blug, but as nothing was handy he began to consider that perhaps the man was right and he had been talking foolishly.|The King looked around for something to throw at General Blug, but as nothing was handy he began to consider that perhaps the man was right and he had been talking foolishly.
emerald_city_of_oz_01_f000067|So he merely threw himself into his glittering throne and tipped his crown over his ear and curled his feet up under him and glared wickedly at Blug.|So he merely threw himself into his glittering throne and tipped his crown over his ear and curled his feet up under him and glared wickedly at Blug.
emerald_city_of_oz_01_f000068|In the first place, said the General, we cannot march across the deadly desert to the Land of Oz. And if we could, the Ruler of that country,|In the first place, said the General, we cannot march across the deadly desert to the Land of Oz. And if we could, the Ruler of that country,
emerald_city_of_oz_01_f000069|Princess Ozma, has certain fairy powers that would render my army helpless.|Princess Ozma, has certain fairy powers that would render my army helpless.
emerald_city_of_oz_01_f000070|Had you not lost your Magic Belt we might have some chance of defeating Ozma; but the Belt is gone.|Had you not lost your Magic Belt we might have some chance of defeating Ozma; but the Belt is gone.
emerald_city_of_oz_01_f000071|I want it! screamed the King. I must have it.|I want it! screamed the King. I must have it.
emerald_city_of_oz_01_f000072|Well, then, let us try in a sensible way to get it, replied the General. The Belt was captured by a little girl named Dorothy, who lives in Kansas,|Well, then, let us try in a sensible way to get it, replied the General. The Belt was captured by a little girl named Dorothy, who lives in Kansas,
emerald_city_of_oz_01_f000073|in the United States of America.|in the United States of America.
emerald_city_of_oz_01_f000074|But she left it in the Emerald City, with Ozma, declared the King.|But she left it in the Emerald City, with Ozma, declared the King.
emerald_city_of_oz_01_f000075|How do you know that? asked the General.|How do you know that? asked the General.
emerald_city_of_oz_01_f000076|One of my spies, who is a Blackbird, flew over the desert to the Land of Oz, and saw the Magic Belt in Ozma's palace, replied the King with a groan.|One of my spies, who is a Blackbird, flew over the desert to the Land of Oz, and saw the Magic Belt in Ozma's palace, replied the King with a groan.
emerald_city_of_oz_01_f000077|Now that gives me an idea, said General Blug, thoughtfully. There are two ways to get to the Land of Oz without traveling across the sandy desert.|Now that gives me an idea, said General Blug, thoughtfully. There are two ways to get to the Land of Oz without traveling across the sandy desert.
emerald_city_of_oz_01_f000078|What are they? demanded the King, eagerly.|What are they? demanded the King, eagerly.
emerald_city_of_oz_01_f000079|One way is OVER the desert, through the air; and the other way is UNDER the desert, through the earth.|One way is OVER the desert, through the air; and the other way is UNDER the desert, through the earth.
emerald_city_of_oz_01_f000080|Hearing this the Nome King uttered a yell of joy and leaped from his throne, to resume his wild walk up and down the cavern.|Hearing this the Nome King uttered a yell of joy and leaped from his throne, to resume his wild walk up and down the cavern.
emerald_city_of_oz_01_f000081|That's it, Blug! he shouted. That's the idea, General! I'm King of the Under World, and my subjects are all miners. I'll make a secret tunnel under the desert to the Land of Oz yes!|That's it, Blug! he shouted. That's the idea, General! I'm King of the Under World, and my subjects are all miners. I'll make a secret tunnel under the desert to the Land of Oz yes!
emerald_city_of_oz_01_f000082|right up to the Emerald City and you will march your armies there and capture the whole country!|right up to the Emerald City and you will march your armies there and capture the whole country!
emerald_city_of_oz_01_f000083|Softly, softly, your Majesty. Don't go too fast, warned the General.|Softly, softly, your Majesty. Don't go too fast, warned the General.
emerald_city_of_oz_01_f000084|My Nomes are good fighters, but they are not strong enough to conquer the Emerald City.|My Nomes are good fighters, but they are not strong enough to conquer the Emerald City.
emerald_city_of_oz_01_f000085|Are you sure? asked the King.|Are you sure? asked the King.
emerald_city_of_oz_01_f000086|Absolutely certain, your Majesty.|Absolutely certain, your Majesty.
emerald_city_of_oz_01_f000087|Then what am I to do?|Then what am I to do?
emerald_city_of_oz_01_f000088|Give up the idea and mind your own business, advised the General.|Give up the idea and mind your own business, advised the General.
emerald_city_of_oz_01_f000089|You have plenty to do trying to rule your underground kingdom.|You have plenty to do trying to rule your underground kingdom.
emerald_city_of_oz_01_f000090|But I want the Magic Belt and I'm going to have it! roared the Nome King.|But I want the Magic Belt and I'm going to have it! roared the Nome King.
emerald_city_of_oz_01_f000091|I'd like to see you get it, replied the General, laughing maliciously.|I'd like to see you get it, replied the General, laughing maliciously.
emerald_city_of_oz_01_f000092|The King was by this time so exasperated that he picked up his scepter, which had a heavy ball, made from a sapphire, at the end of it, and threw it with all his force at General Blug.|The King was by this time so exasperated that he picked up his scepter, which had a heavy ball, made from a sapphire, at the end of it, and threw it with all his force at General Blug.
emerald_city_of_oz_01_f000093|The sapphire hit the General upon his forehead and knocked him flat upon the ground, where he lay motionless. Then the King rang his gong and told his guards to drag out the General and throw him away; which they did.|The sapphire hit the General upon his forehead and knocked him flat upon the ground, where he lay motionless. Then the King rang his gong and told his guards to drag out the General and throw him away; which they did.
emerald_city_of_oz_01_f000094|This Nome King was named Roquat the Red, and no one loved him. He was a bad man and a powerful monarch, and he had resolved to destroy the Land of Oz and its magnificent Emerald City,|This Nome King was named Roquat the Red, and no one loved him. He was a bad man and a powerful monarch, and he had resolved to destroy the Land of Oz and its magnificent Emerald City,
emerald_city_of_oz_01_f000095|to enslave Princess Ozma and little Dorothy and all the Oz people, and recover his Magic Belt.|to enslave Princess Ozma and little Dorothy and all the Oz people, and recover his Magic Belt.
emerald_city_of_oz_01_f000096|This same Belt had once enabled Roquat the Red to carry out many wicked plans; but that was before Ozma and her people marched to the underground cavern and captured it.|This same Belt had once enabled Roquat the Red to carry out many wicked plans; but that was before Ozma and her people marched to the underground cavern and captured it.
emerald_city_of_oz_01_f000097|The Nome King could not forgive Dorothy or Princess Ozma, and he had determined to be revenged upon them.|The Nome King could not forgive Dorothy or Princess Ozma, and he had determined to be revenged upon them.
emerald_city_of_oz_01_f000098|But they, for their part, did not know they had so dangerous an enemy.|But they, for their part, did not know they had so dangerous an enemy.
emerald_city_of_oz_01_f000099|Indeed, Ozma and Dorothy had both almost forgotten that such a person as the Nome King yet lived under the mountains of the Land of Ev which lay just across the deadly desert to the south of the Land of Oz.|Indeed, Ozma and Dorothy had both almost forgotten that such a person as the Nome King yet lived under the mountains of the Land of Ev which lay just across the deadly desert to the south of the Land of Oz.
emerald_city_of_oz_01_f000100|An unsuspected enemy is doubly dangerous.|An unsuspected enemy is doubly dangerous.
emerald_city_of_oz_01_f000101|End of chapter one.|End of chapter one.
emerald_city_of_oz_02_f000001|This is there librivox recording. All librivox recordings are in the public domain. For more information or to volunteer please visit librivox dot org.|This is there librivox recording. All librivox recordings are in the public domain. For more information or to volunteer please visit librivox dot org.
emerald_city_of_oz_02_f000002|The The Emerald City of Oz by L Frank Baum. Chapter 2. How Uncle Henry Got Into Trouble Dorothy Gale lived on a farm in Kansas, with her Aunt Em and her Uncle Henry.|The The Emerald City of Oz by L Frank Baum. Chapter two. How Uncle Henry Got Into Trouble Dorothy Gale lived on a farm in Kansas, with her Aunt Em and her Uncle Henry.
emerald_city_of_oz_02_f000003|It was not a big farm, nor a very good one, because sometimes the rain did not come when the crops needed it, and then everything withered and dried up.|It was not a big farm, nor a very good one, because sometimes the rain did not come when the crops needed it, and then everything withered and dried up.
emerald_city_of_oz_02_f000004|Once a cyclone had carried away Uncle Henry's house, so that he was obliged to build another; and as he was a poor man he had to mortgage his farm to get the money to pay for the new house.|Once a cyclone had carried away Uncle Henry's house, so that he was obliged to build another; and as he was a poor man he had to mortgage his farm to get the money to pay for the new house.
emerald_city_of_oz_02_f000005|Then his health became bad and he was too feeble to work. The doctor ordered him to take a sea voyage and he went to Australia and took Dorothy with him.|Then his health became bad and he was too feeble to work. The doctor ordered him to take a sea voyage and he went to Australia and took Dorothy with him.
emerald_city_of_oz_02_f000006|That cost a lot of money, too.|That cost a lot of money, too.
